{
  "attempt_index": 0,
  "duration_seconds": 0.0,
  "error": "Ollama request failed for minimax-m2.1:cloud: HTTP Error 410: Gone",
  "error_type": "AdapterError",
  "grades": [],
  "manifest": {
    "created_at": "2026-07-31T08:43:49+00:00",
    "max_tokens": 512,
    "model": {
      "harness_name": "medphysbench-ollama",
      "harness_revision": "reference-json-v1",
      "model_name": "minimax-m2.1:cloud",
      "model_revision": "minimax-m2.1:cloud",
      "provider": "ollama"
    },
    "prompt_hash": "48ad15d34014b7d0a3be73983af64a9fa9cedb111acaa845cc3a08d353613c74",
    "run_id": "940d08dc-3e83-4d87-ab41-1748980356bf",
    "runtime_task_hash": "7a80375a79f4cccd2d0dd4cf45099fbeef65f4e3f2d85d4547687ad8a6a330f8",
    "sandbox_image_digest": "not-executed-provider-access-v0.3.0",
    "schema_version": "medeval.run.v1",
    "seed": 20260731,
    "system_prompt_hash": "f0600dd21974b88794f8dac7136e7ca1c66a1cb47913fa52ed7727c12008174e",
    "task_id": "public.rt.eqd2-001",
    "task_version": "0.2.0",
    "temperature": 0.0,
    "tool_environment_version": "public-fixtures-v0.2.0",
    "tool_schema_hash": "4f53cda18c2baa0c0354bb5f9a3ecbe5ed12ab4d8e11ba873c2f11161202b945"
  },
  "output": {},
  "passed": false,
  "raw_response": {},
  "safe": false,
  "score": 0.0,
  "status": "error",
  "trace": []
}
